{
  "hospitalId": "seoul-central",
  "name": "서울센트럴동물병원",
  "city": "서울 서초구 반포동",
  "address": "서울 서초구 신반포로 45",
  "phone": "02-5407-5708",
  "theme": "navy",
  "specialty": "정형외과 · CT 정밀진단 · 고양이 특화",
  "businessHours": "평일 10:00 ~ 19:00 / 주말 10:00 ~ 17:00",
  "monsmectaPartner": true,
  "features": { "triage": true, "summaryPdf": true, "counterPoster": true, "qrPortal": true },
  "seo": { "titleSuffix": "몬스멕타 파트너 DX 공식 인증병원", "description": "서울센트럴동물병원 - 정형외과 CT센터, 몬스멕타 파트너 인증" }
}
